{
    "attributes": {
        "modelPrefix": "bardwell-creek",
        "plan": "01",
        "empty": "",
        "inner": "has{braces}inside",
        "self": "{ATTR::self}"
    },
    "stores": [
        {
            "name": "FFRD",
            "store_type": "S3",
            "profile": "FFRD",
            "params": {
                "root": "/model-library"
            }
        }
    ],
    "inputs": [],
    "outputs": [
        {
            "name": "out",
            "paths": {
                "default": "prefix-{ATTR::modelPrefix}-suffix.hdf"
            },
            "store_name": "FFRD"
        }
    ],
    "actions": []
}
