{
    "attributes": {
        "modelPrefix": "bardwell-creek",
        "plan": "01"
    },
    "stores": [
        {
            "name": "FFRD",
            "store_type": "S3",
            "profile": "FFRD",
            "params": {
                "root": "/model-library"
            }
        }
    ],
    "inputs": [
        {
            "name": "rasOutput",
            "paths": {
                "default": "mymodel/mymodel.p01.hdf"
            },
            "store_name": "FFRD"
        }
    ],
    "outputs": [
        {
            "name": "out",
            "paths": {
                "default": "sims/01/out.hdf"
            },
            "store_name": "FFRD"
        }
    ],
    "actions": [
        {
            "name": "compute",
            "type": "compute",
            "attributes": {
                "fast": true
            }
        }
    ]
}
