{
    "attributes": {},
    "stores": [
        {
            "name": "FFRD",
            "store_type": "S3",
            "profile": "FFRD",
            "params": {
                "root": "/model-library"
            }
        }
    ],
    "inputs": [],
    "outputs": [
        {
            "name": "result",
            "paths": {
                "default": "out/result.hdf"
            },
            "store_name": "FFRD"
        }
    ],
    "actions": [
        {
            "name": "compute",
            "type": "compute"
        }
    ]
}
