{
    "attributes": {
        "store_name": "this-is-an-attribute-not-a-reference",
        "profile": "also-just-an-attribute"
    },
    "stores": [
        {
            "name": "FFRD",
            "store_type": "S3",
            "profile": "FFRD",
            "params": {
                "root": "/model-library"
            }
        }
    ],
    "inputs": [
        {
            "name": "i",
            "paths": {
                "default": "a.json"
            },
            "store_name": "FFRD"
        }
    ],
    "outputs": [],
    "actions": []
}
