{
    "attributes": {},
    "stores": [
        {
            "name": "FFRD",
            "store_type": "S3",
            "profile": "FFRD",
            "params": {
                "root": "/model-library"
            }
        }
    ],
    "inputs": [
        {
            "name": "model",
            "paths": {
                "default": "a/model.json"
            },
            "store_name": "FFRD"
        },
        {
            "name": "model",
            "paths": {
                "default": "b/model.json"
            },
            "store_name": "FFRD"
        }
    ],
    "outputs": [],
    "actions": []
}
