{
    "attributes": {},
    "stores": [
        {
            "name": "FFRD",
            "store_type": "S3",
            "profile": "FFRD",
            "params": {
                "root": "/model-library"
            }
        }
    ],
    "inputs": [],
    "outputs": [],
    "actions": [
        {
            "name": "compute_json",
            "type": "compute_json",
            "description": "compute something",
            "params": {
                "parameter1": true,
                "parameter2": "parametervalue2",
                "parameter3": "2.3"
            }
        }
    ]
}
